{
  "schema_version": 1,
  "id": "narrivy/whisper-large-v3-openvino-int8",
  "revision": "2026-09-30.1",
  "display_name": "Whisper large-v3 (OpenVINO IR, INT8, 8-bit)",
  "source": {
    "provider": "huggingface",
    "locator": "OpenVINO/whisper-large-v3-int8-ov",
    "immutable_revision": "e197310d1fe6d5b40d0ce84c2614a547de21cb62",
    "publisher": "OpenVINO"
  },
  "engine": {
    "id": "asr-openvino",
    "min_version": "2026.4",
    "max_version": null
  },
  "format": {
    "family": "whisper",
    "precision": "INT8",
    "conversion_recipe": null
  },
  "tasks": [
    "transcribe",
    "translate"
  ],
  "languages": [
    "multilingual"
  ],
  "files": [
    {
      "path": "added_tokens.json",
      "sha256": "3c51f66c4c21f9e126970078f11ae77a78c74aee8df606ee9daba86e467108e0",
      "size_bytes": 34648,
      "optional_signature": null
    },
    {
      "path": "config.json",
      "sha256": "2efba1fd9d65450929e2d917a32cf9dec2fd5682d29baa6ff48d31d3a61fb501",
      "size_bytes": 1195,
      "optional_signature": null
    },
    {
      "path": "generation_config.json",
      "sha256": "041bb1619064440f4cb37a53326f5394de3df380f52ca1e2bfae599535414a7b",
      "size_bytes": 3898,
      "optional_signature": null
    },
    {
      "path": "merges.txt",
      "sha256": "2df2990a395e35e8dfbc7511e08c12d56018d8d04691e0133e5d63b21e154dc6",
      "size_bytes": 493869,
      "optional_signature": null
    },
    {
      "path": "normalizer.json",
      "sha256": "bf1c507dc8724ca9cf9903640dacfb69dae2f00edee4f21ceba106a7392f26dd",
      "size_bytes": 52666,
      "optional_signature": null
    },
    {
      "path": "openvino_config.json",
      "sha256": "ac8140917e9fae6585bf5a937d4a76fa83015fbaaa1000db434a5d8e39e774f5",
      "size_bytes": 451,
      "optional_signature": null
    },
    {
      "path": "openvino_decoder_model.bin",
      "sha256": "fdf13685d5a9c427b9aa5893c2baef362f1e4dddfbf5bf8a47fc03acb35a45ea",
      "size_bytes": 910372790,
      "optional_signature": null
    },
    {
      "path": "openvino_decoder_model.xml",
      "sha256": "cc4b29bb1fc4afb6dcc59db2cf3d149fe5847a7215ca66b4944cb36390b17805",
      "size_bytes": 2869528,
      "optional_signature": null
    },
    {
      "path": "openvino_detokenizer.bin",
      "sha256": "f2b3c47825a1089525ff65c0c8e49271e1dee69a401a04fc827ac2de5b7766e4",
      "size_bytes": 736198,
      "optional_signature": null
    },
    {
      "path": "openvino_detokenizer.xml",
      "sha256": "ac37fdd9b044a04130747c6773b85f395e5910e0cfb132a2c937fb533d69b4da",
      "size_bytes": 9699,
      "optional_signature": null
    },
    {
      "path": "openvino_encoder_model.bin",
      "sha256": "fffcbf47a4cfd5a1e3f57c0569f5ef706245b798ef626db5ffea7b84166ed865",
      "size_bytes": 645332592,
      "optional_signature": null
    },
    {
      "path": "openvino_encoder_model.xml",
      "sha256": "2a19e0ae9b77b5fbf2928793aa232eb84b0554a29fd4f16e190617583bdefcfc",
      "size_bytes": 1518681,
      "optional_signature": null
    },
    {
      "path": "openvino_tokenizer.bin",
      "sha256": "adfa3d9a2920d0f314121270a960ab331ec0f05838544bb8ecaaa422282a6fd4",
      "size_bytes": 1898973,
      "optional_signature": null
    },
    {
      "path": "openvino_tokenizer.xml",
      "sha256": "dad2092c08510c043acabeae952cdbd381bc7b9c3272eaef524fa4fbea2f9dc4",
      "size_bytes": 27011,
      "optional_signature": null
    },
    {
      "path": "preprocessor_config.json",
      "sha256": "654cf18d3e163b948ceaf9766da56ce0b52de265d58673cf61c9376f126bd499",
      "size_bytes": 357,
      "optional_signature": null
    },
    {
      "path": "special_tokens_map.json",
      "sha256": "baea4ea09372eb4fca86b4e4346139fd73cb807d5087e9de0948e971739c3e74",
      "size_bytes": 2186,
      "optional_signature": null
    },
    {
      "path": "tokenizer.json",
      "sha256": "5c1bf30c9e716e1477bedef846b01be0013daecb89e9e3ef7ab89b23c178df1b",
      "size_bytes": 3930645,
      "optional_signature": null
    },
    {
      "path": "tokenizer_config.json",
      "sha256": "3c75940dfce3a294fca7041a5faff011677f1b68fa85e47511bb8cf6dccaded6",
      "size_bytes": 282873,
      "optional_signature": null
    },
    {
      "path": "vocab.json",
      "sha256": "6788c80b082e9b0d1393147d3a3e62ba19285ac0c82ace8e5ef00f37ead58971",
      "size_bytes": 835528,
      "optional_signature": null
    }
  ],
  "devices": [
    "CPU",
    "GPU",
    "NPU"
  ],
  "runtime_constraints": {
    "notes": "Quantization: INT8 (8-bit weights). Returns text after you stop. May run on CPU, GPU, NPU; a device is used only after this exact model, runtime, driver and device pass qualification on the user's computer."
  },
  "license": {
    "spdx_or_name": "Apache-2.0",
    "source": "https://huggingface.co/OpenVINO/whisper-large-v3-int8-ov",
    "redistribution": "allowed",
    "notice": "Whisper large-v3 by OpenAI; OpenVINO IR conversion and INT8 compression by Intel (OpenVINO). Redistributed unmodified."
  }
}
